cs56-games-battleship, NO , mastergberry , OliverHKU  , Battleship game (Discontinued) , 24 , Project 2 Pull Request , OliverHKU , closed , 
cs56-games-battleship, NO , mastergberry , OliverHKU  , Battleship game (Discontinued) , 23 , Potential Risk of the Newly Added Ship Size Customization Feature , OliverHKU , closed , I suddenly found a bug in the recently added feature (let user input 5 integers). It turned out that if the user inputs a string other than integer (say he inputs "three" somehow). the program will report an error and the reminder message won't appear. I'm now trying to fix the bug.  @andrewberls   ~estimated 50
cs56-games-battleship, NO , mastergberry , OliverHKU  , Battleship game (Discontinued) , 22 , Adding Hit Count , OliverHKU , closed , Since the new feature (ship size customization) is already added. if the player chooses 5 big integers as their ship size. it would be hard for them to remember how many squares they've already hit all the time. It's time to add a hit count feature to record the number of squares already be hit.  @andrewberls     ~estimated 200
cs56-games-battleship, NO , mastergberry , OliverHKU  , Battleship game (Discontinued) , 21 , Improve Computer Algorithm , OliverHKU , open , It seems right now that the algorithm for even the "hard" mode for the computer is still too easy to beat. I'm considering improving the algorithm for the computer so that the "medium" and "hard" mode could be more challenging.  @andrewberls     ~estimated 350
cs56-games-battleship, NO , mastergberry , OliverHKU  , Battleship game (Discontinued) , 20 , Update README.md File , OliverHKU , open , Update the README.md file such that it will give a high-level description of how the game works. about the new feature added. and future expectation of improvements of the game. In addition. there might be a link to a demo video of the game.  @andrewberls 
cs56-games-battleship, NO , mastergberry , OliverHKU  , Battleship game (Discontinued) , 19 , Pull Request for Project 1 , OliverHKU , closed , @andrewberls  ~requested: 600
cs56-games-battleship, NO , mastergberry , OliverHKU  , Battleship game (Discontinued) , 18 , Allow the user to decide ship sizes in GUI , pconrad , closed , OliverHKU , Up to now. the ship sizes are still fixed (say {2.3.3.4.5}).     Add a feature to allow the user to decide what sizes of ships he / she wants.    This will be achieved by adding a new frame if the player selects the "play against the computer" mode. and letting the player key in 5 integers not exceeding 10. then setting the ship sizes according to the input.    ~estimated 300    (100 for just adding the user interface elements---200 for making them actually work.  I suggest that you attack in two phases---add the user interface element FIRST. with a label that says "THIS FEATURE NOT IMPLEMENTED YET") but get that working.  That is. the program will accept the input. and validate that the input is valid. but it will NOT actually change the hard coded sizes of battleships.       Then. change the code so that the feature works. and remove the warning label.
cs56-games-battleship, NO , mastergberry , OliverHKU  , Battleship game (Discontinued) , 17 , Issue: Objectify , kreimer314 , closed , OliverHKU , The resolution of a previous issue has greatly reduced the complexity of this code and compacted it. However. it has been left in a disorganized and highly 'clumped' state. There are many opportunities to clean up this code. move features to methods. and most importantly. modulate components in accordance to object oriented programming philosophies.    Consider:  - Looking for repeated code that can be made into a method  - Making an external object of the GUI's inner class Board  - Making the controller better by having the majority of its functions methodized  - Renaming variables and parameters to achieve consistency and ease of understanding  - Adding comments and Javadoc comments where they are lacking    ~estimated: 300 points    
cs56-games-battleship, NO , mastergberry , OliverHKU  , Battleship game (Discontinued) , 16 , Issue: Player Placed Ships #14 , kreimer314 , closed , @kreimer314 @CARammelkamp    This was much more difficult than I had originally anticipated. so I'm requesting more points as compensation. I went the extra mile to have a 'floating' ship follow the cursor while the player is placing ships.    ~requested 300    Note: I am very pressed for time right now and this new code is not clean or well documented. I apologize for that and I feel very sorry for the next person that chooses to work on it.
cs56-games-battleship, NO , mastergberry , OliverHKU  , Battleship game (Discontinued) , 15 , Give user's room to make mistakes setting up game , kreimer314 , open , OliverHKU , Right now the game setup is all or nothing. Implement some kind of reset to the game so that player's do not need to restart the program to try the setup again.    Requested: 100 points
cs56-games-battleship, NO , mastergberry , OliverHKU  , Battleship game (Discontinued) , 14 , Player Placed Ships , kreimer314 , closed , Implement a means for player's to place their own ships.    Requested: 200 points
cs56-games-battleship, NO , mastergberry , OliverHKU  , Battleship game (Discontinued) , 13 , Issue Resolved: Refactor & Add Client Server Functionality #11 , kreimer314 , closed , @CARammelkamp    Resolved issue #11    Request 500+. I've completed the requirements for the stated 500. however. I took extra time to make it pretty and add javadoc comments. If you think my work is worthy of any extra points please be generous!
cs56-games-battleship, NO , mastergberry , OliverHKU  , Battleship game (Discontinued) , 12 , new issues for battleship game , twodimension , open , OliverHKU , I am thinking to add difficulty level for the game and different kinds of ships. User can choose the size of the grid. User can play with computer and another player. I am wondring how many points estimated i can get?
cs56-games-battleship, NO , mastergberry , OliverHKU  , Battleship game (Discontinued) , 11 , Refactor & Add client/server functionality , CARammelkamp , closed , kreimer314 , Refactor the battleship program into nice clean model. view. controller configuration as well as implement the client-server functionality.
cs56-games-battleship, NO , mastergberry , OliverHKU  , Battleship game (Discontinued) , 10 , add picture and sound to the GUI , twodimension , open , OliverHKU , i am just think to add some pics and sounds to the BattleshipGUI for proj2. I wondering how much points i can get in total. If there is more issues so that I can have 600 points for proj2 and proj3. that will be cool.  @gonfunko @jasenmh @pconrad 
cs56-games-battleship, NO , mastergberry , OliverHKU  , Battleship game (Discontinued) , 9 , Issue: Make GUI #2 , twodimension , closed , the new submition.@CommanderHamster
cs56-games-battleship, NO , mastergberry , OliverHKU  , Battleship game (Discontinued) , 8 , the version that works , twodimension , closed , finish on creating a GUI and controller and modifying the model.
cs56-games-battleship, NO , mastergberry , OliverHKU  , Battleship game (Discontinued) , 7 , Pull request project1 submission , FamiliarStranger- , closed , ~moderator: @ScottBishop  ~requested: 60
cs56-games-battleship, NO , mastergberry , OliverHKU  , Battleship game (Discontinued) , 6 , Factor out the horrifying duplicate code that converts between int representations of battlefield locations and A4, J7 type representations , pconrad , open , OliverHKU , There are multiple instances of this kind of code:    	String readableLocation = "" + (char)(computerMove/10+65) + computerMove%10;    Ouch. that's horrible. and it occurs in many places throughout the code.    Replace this with a method:    ```  /** Take a position 0 through 99. and convert it to row column. e.g 0 becomes A0. 1 becomes A1. 2 becomes A2. etc.  and 10 becomes B0. 11 becomes B1. etc.   */    public static String int2LetterNumber(int pos) {      }  ```    Make another method:    ```  /** Take a string such A1. B2. J5 and return the integer between 0 and 99 that represents the position on the battlefield.  */    public static int letterNumber2int(String letterNumber) {      }  ```    then replace all instances of that horrible code with this new method.    estimate 60  
cs56-games-battleship, NO , mastergberry , OliverHKU  , Battleship game (Discontinued) , 5 , Add Host and Join functionality to GUI , CommanderHamster , closed , kreimer314 , ~estimated 170    Add the ability to host and join games in the GUI version of the game.    ~depends #3 
cs56-games-battleship, NO , mastergberry , OliverHKU  , Battleship game (Discontinued) , 4 , Make yet another GUI - Issue #3 - Keenan Reimer , kreimer314 , closed , As discussed in lab. #3 
cs56-games-battleship, NO , mastergberry , OliverHKU  , Battleship game (Discontinued) , 3 , Make yet another GUI , pconrad , closed , kreimer314 , So. @twodimension and @kreimer314  you may BOTH work on this.   We are going to create two separate issues. and and assign one to each of you.    In the end. we may end creating separate "branches" in the origin repo. one for each of your versions. and then deciding which one to keep.    Please try to use a good MVC (Model-View-Controller) separation between your model class and your GUI.     Ask a moderator to help you understand what this design pattern means.   The basic idea is that you want to keep the "model" of Battleship independent of the "user interface"---so the classes that make the game work "don't know. and don't care" whether the user is using a command line interface. or a GUI interface.  You are not CHANGING the interface from command line to GUI. you are ADDING a GUI interface. but RETAINING the command line interface. and keeping the parts of the game that are common to both as separate as possible from the details of the user interaction.
cs56-games-battleship, NO , mastergberry , OliverHKU  , Battleship game (Discontinued) , 2 , Make GUI , ScottBishop , closed , twodimension , Right now it is only a command line version of the game. Make a GUI to display game choice. choose difficulty. and then play the game by either typing in places to fire missiles or by clicking the square.    ~value 300 
cs56-games-battleship, NO , mastergberry , OliverHKU  , Battleship game (Discontinued) , 1 , Update repo , kjorg50 , closed , improvements
cs56-games-blackjack, W15-YES , mliou , JaredBJensen (4pm) , (jstaahl) Blackjack game , 21 , Lab07 pull request , JaredBJensen , open , Fixed #14. #15. and #16. Save and load buttons for stats are self-explanatory during gameplay. Leave game button pops up for each player at the end of each round.     Started work on #7. Split hand button pops up if player has cards of equal value. When clicked it will deal the player a new hand after split and display it on the screen. However. the code to actually play these two split hands separately has not yet been implemented. 
cs56-games-blackjack, W15-YES , mliou , JaredBJensen (4pm) , (jstaahl) Blackjack game , 20 , Add ability to "tip" the dealer , JaredBJensen , open , Any good dealer deserves a tip. Add an instance variable to the dealer that keeps track of his tips for a given game. Or his tips could be a saved stat that is preserved across different gameplay sessions. Then add another button at the end of each round allowing each player a chance to tip the dealer a given amount.     estimated ~150
cs56-games-blackjack, W15-YES , mliou , JaredBJensen (4pm) , (jstaahl) Blackjack game , 19 , Add ability to upload picture for player , JaredBJensen , open , On the screen where players' names are typed in. a button could appear next to each name that allows them to choose a file path for a picture to upload. Then. the game can save this picture as an instance variable for the player and display it next to their name during gameplay.     estimated ~300
cs56-games-blackjack, W15-YES , mliou , JaredBJensen (4pm) , (jstaahl) Blackjack game , 18 , Lab06 new pull request , JaredBJensen , open , 
cs56-games-blackjack, W15-YES , mliou , JaredBJensen (4pm) , (jstaahl) Blackjack game , 17 , Pull request for lab06. Added statistics tracker to the game , JaredBJensen , closed , 
cs56-games-blackjack, W15-YES , mliou , JaredBJensen (4pm) , (jstaahl) Blackjack game , 16 , Allow player(s) to back out of the game , ericpalyan , open , If playing with multiple players. there should be an option for a player to quit/back out of the game without having to exit the entire program and then select less amount of players. set it up. etc. This should remove the player's jpanel and components from the Blackjack window and update the game instances such as number of players. and so on.    ~estimated 100
cs56-games-blackjack, W15-YES , mliou , JaredBJensen (4pm) , (jstaahl) Blackjack game , 15 , Add Save/Load feature , ericpalyan , open , ~depends #14     Allow the user(s) to save their statistics such as wins/losses/money/etc. so that they can return another time and load their data and continue on from there adding to their current statistics. Since most of the data should be primitives. consider simply outputting to a raw text file for the save and an algorithm to read back the data from the file as the load method.    ~estimated: 200
cs56-games-blackjack, W15-YES , mliou , JaredBJensen (4pm) , (jstaahl) Blackjack game , 14 , Add Game Statistics , ericpalyan , open , ~depends #8   What is a game without keeping score? Enhance the game by keeping track of statistics such as each player's: wins. losses. money made/lost. etc. and displaying the updated stats at the end of each round.    ~estimated 150
cs56-games-blackjack, W15-YES , mliou , JaredBJensen (4pm) , (jstaahl) Blackjack game , 13 , Refactor BlackjackGui.java , ericpalyan , open , A lot of the code could be factored out. placed as helper methods. organized and commented. etc. Currently there is a lot of jumbled code which can be cleaned up for efficiency and clarity of code.    ~estimated 300
cs56-games-blackjack, W15-YES , mliou , JaredBJensen (4pm) , (jstaahl) Blackjack game , 12 , Issues #8 and #9... Moderator: andrewberls , ericpalyan , closed , Issues that needed resolving before moving on:  *Cleaning up the code and adding comments*  There was very little comments and the code was in big chunks. Made it difficult to understand what was being done. Had to go through and add comments. format it better. move some things around for efficiency. etc.  ~request 100    *Cleaning up/Enhancing the GUI*  The window frames would pop up off screen and the widgets were not aligned. Fixed those and also formatted the player panels to make them "layered" instead of all the text being on one line (the JLabels that display player information).   ~request 100    Main Issues  *Issue #8 - Currency*  Had to work around a few things and figure out how the code was executing and in what order. I also had to make multiple methods to keep track of changes as well as keep the labels updated etc. It took some time to implement so I did not have time to allow the user to change the bet value after each hand but that can be easily added the next time.  ~request: 200    *Issue #9 - Double Down*  It only allows the player to double down at the beginning of their hand. Once they hit the option disables/"goes away". Doubling down deducts the bet amount from the player's money on hand and draws one card. After that the player can't hit. it goes on to the next player at the table (or the dealer).  ~request: 150    Other Issues/Enhancements  *Rules Frame*  Added a rules window explaining how the game is played along with winning/losing conditions. etc for those who are not familiar with blackjack or need a reminder.  ~request: 75    *5 Card Charlie*  This is another rule in blackjack (or in a form of one). Having 5 cards without busting is another condition to win. Blackjack(21) > 5 card charlie.  ~request: 75      ------------------------------------  ~request total: 700  ------------------------------------
cs56-games-blackjack, W15-YES , mliou , JaredBJensen (4pm) , (jstaahl) Blackjack game , 11 , Refactor code before issue #3 , pconrad , closed ,     Before we do #3 we need to do some refactoring.    (This is just a test showing how to enter new issues.. refactoring may or may not be necessary)
cs56-games-blackjack, W15-YES , mliou , JaredBJensen (4pm) , (jstaahl) Blackjack game , 10 , Add networked multiplayer functionality , jstaahl , open , ericpalyan , The game as it stands already has the possibility to be played with multiple players on a single machine. Using a server-client set up and java's built in socket libraries. add in the functionality for the game to be played by any combination of local and/or remote players.    ~estimated 300
cs56-games-blackjack, W15-YES , mliou , JaredBJensen (4pm) , (jstaahl) Blackjack game , 9 , Allow the user to "double down" , jstaahl , closed , ericpalyan , ~depends #8     After implementing the ability to bet fake money. add in another option for the user to "double down" on the first move.    This means the user will double their bet after seeing their cards and the dealer will deal them only 1 card. They either bust. or don't. Either way it's the end of their turn.    ~estimated 100
cs56-games-blackjack, W15-YES , mliou , JaredBJensen (4pm) , (jstaahl) Blackjack game , 8 , Add in fake money and betting. , jstaahl , closed , ericpalyan , Add in the ability for a user to specify a starting dollar amount after they enter their name. Then allow them to choose a bet size before each hand. Update their total with each win or loss.    ~estimated 150
cs56-games-blackjack, W15-YES , mliou , JaredBJensen (4pm) , (jstaahl) Blackjack game , 7 , Add in functionality for splitting your hand when you have a pair of equal value cards. , jstaahl , open , ericpalyan , If the user has two cards in their hand of the same value. an extra option to split their hand should appear on screen alongside "hit" and "stay".  Add in the proper game flow to play each hand individually.    Also remember a hand can be split more than once. (User is dealt two 6's. they split... When playing their first hand they are dealt another 6. they split again....)    ~estimated 150
cs56-games-blackjack, W15-YES , mliou , JaredBJensen (4pm) , (jstaahl) Blackjack game , 6 , Fixed minor portability issue.  , Yokura , closed , Added a portable junit.jar file to the lib directory.  Project should now work on all machines. and not just csil machines where it can get pconrad's junit.jar file.     No points requested.  
cs56-games-blackjack, W15-YES , mliou , JaredBJensen (4pm) , (jstaahl) Blackjack game , 5 , Completed required updates , Yokura , closed , Finished updating the project (JWS. javadoc. refactoring... etc).   JUnit tests were a little harder to try to refine. Everything should be up to date by current conventions though. 
cs56-games-blackjack, W15-YES , mliou , JaredBJensen (4pm) , (jstaahl) Blackjack game , 4 , Project Stewardship , leifdreizler , closed , Yokura , *Make existing package structure conform to new standards  *Remove all references to JWS  *Fix all english grammatical/capitalization errors in Javadoc  *Fill in missing Javadoc parameters as necessary  *Review unit Tests and ensure good test coverage
cs56-games-blackjack, W15-YES , mliou , JaredBJensen (4pm) , (jstaahl) Blackjack game , 3 , Another meta-issue, to practice more github markdown related to issues , kjorg50 , closed , cs56-games-blackjack, W15-YES , mliou , JaredBJensen (4pm) , (jstaahl) Blackjack game , 2 , KyleDue0301 , pconrad , closed , See #2 
cs56-games-blackjack, W15-YES , mliou , JaredBJensen (4pm) , (jstaahl) Blackjack game , 2 , This is really a meta-issue: take the suggestions for features and make them issues , pconrad , closed , kjorg50 , cs56-games-blackjack, W15-YES , mliou , JaredBJensen (4pm) , (jstaahl) Blackjack game , 2 , KyleDue0301 , pconrad , closed , Like we talked about on Friday.   
cs56-games-blackjack, W15-YES , mliou , JaredBJensen (4pm) , (jstaahl) Blackjack game , 1 , Replaced issue xxx with best version, and links to other archived versions , kjorg50 , closed , pconrad , cs56-games-blackjack, W15-YES , mliou , JaredBJensen (4pm) , (jstaahl) Blackjack game , 1 , Our first milestone , kjorg50 , closed , Kyle submitted this after a discussion about how to better organize the repos for choice points projects.
cs56-networking-chat, W15-YES , alecharrell , xuejingzhou"," zixia(4pm) , A chat application that uses a client and a server , 16 , lab07 done , xuejingzhou , open , finished all issues in lab06.md
cs56-networking-chat, W15-YES , alecharrell , xuejingzhou"," zixia(4pm) , A chat application that uses a client and a server , 15 , Delete a user in contacts , ZixiaWeng , open , Make a feature that users can delete a person in their contact lists. You may make a button to delete a user in the contact list and the user you deleted will currently not appear in your contact list. 
cs56-networking-chat, W15-YES , alecharrell , xuejingzhou"," zixia(4pm) , A chat application that uses a client and a server , 14 , filter the messages from different users , ZixiaWeng , open , Make a feature that when a user selects a person in his/her contact list and starts a conversation. the window will only show the messages between that user and the person he selects. It will not show the messages from other users. Also. when one clicks the Broadcast option. it will only show the messages who talks with broadcast.
cs56-networking-chat, W15-YES , alecharrell , xuejingzhou"," zixia(4pm) , A chat application that uses a client and a server , 13 , making new account , xuejingzhou , open , * Issue: sign up a new account with new username and password in the login window. write the infomation into the data file and make it usable for the next time.
cs56-networking-chat, W15-YES , alecharrell , xuejingzhou"," zixia(4pm) , A chat application that uses a client and a server , 12 , private room with multiple people , xuejingzhou , open , * Issue: create private chatting room for a group of people the user invites. In the chatting room. it will only display the messages from the users inside the chatting room.
cs56-networking-chat, W15-YES , alecharrell , xuejingzhou"," zixia(4pm) , A chat application that uses a client and a server , 11 , Show number of users who are online  , xuejingzhou , closed , Instantly showing the number of all online users. display a message "no body is online" when a user is broadcasting but no other user is online. ---150 points
cs56-networking-chat, W15-YES , alecharrell , xuejingzhou"," zixia(4pm) , A chat application that uses a client and a server , 10 , Switch Text font , xuejingzhou , open , Add a button for users to switch the font for the text. and print a notification to users. telling the current font and size.  ---200 points
cs56-networking-chat, W15-YES , alecharrell , xuejingzhou"," zixia(4pm) , A chat application that uses a client and a server , 9 , add W15_lab06.md file , xuejingzhou , closed , 
cs56-networking-chat, W15-YES , alecharrell , xuejingzhou"," zixia(4pm) , A chat application that uses a client and a server , 8 , Test if on different Network chat works , alecharrell , open , Test on different subnets and test to see if it works. If it does. no changes necessary. If it doesn't then make it work and possibly add some application layer security encryption?
cs56-networking-chat, W15-YES , alecharrell , xuejingzhou"," zixia(4pm) , A chat application that uses a client and a server , 7 , Fixed Issue #1 and package structure , ericchen94 , closed , @jcneally    Fixed the problems in issue #1 that were present in the last pull request.
cs56-networking-chat, W15-YES , alecharrell , xuejingzhou"," zixia(4pm) , A chat application that uses a client and a server , 6 , Add Online User Count  , ericchen94 , open , Add a counter to track the number of online users. This counter should appear on both the server and the client.
cs56-networking-chat, W15-YES , alecharrell , xuejingzhou"," zixia(4pm) , A chat application that uses a client and a server , 5 , Create Private Chat Room Feature , ericchen94 , closed , Add functionality to allow users to create private chat rooms. and to be able to invite other users on their friend list to join. The messages on the private chat room would not be broadcasted to all users. but instead only to the users in the chat room.
cs56-networking-chat, W15-YES , alecharrell , xuejingzhou"," zixia(4pm) , A chat application that uses a client and a server , 4 , Implemented features in networking chat project under ericchen94 directory , ericchen94 , closed , kjorg50 , @jcneally
cs56-networking-chat, W15-YES , alecharrell , xuejingzhou"," zixia(4pm) , A chat application that uses a client and a server , 3 , Fix Direct Messages , jcneally , open , ericchen94 , When sending messages to specific users. it is unclear that this is a direct message to the user. Make this clear through a "whisper" system. or some kind of color/text indication.    ~estimated 50 points
